{
  "schema_version": "1.0.0",
  "source": "vtop-tampermonkey",
  "campus": "Vellore",
  "semester_label": "Winter Semester 2026-27",
  "captured_at": "2000-01-01T00:00:00Z",
  "courses": [
    {
      "category": "PC",
      "course_code": "MDI3002",
      "course_title": "Foundations of Data Science",
      "allocations": [
        {
          "source_row": 1,
          "slot": "G1+TG1",
          "venue": "PRP221",
          "faculty": "GOVINDA K",
          "course_type": "TH"
        },
        {
          "source_row": 2,
          "slot": "G2+TG2",
          "venue": "PRP219",
          "faculty": "ERAPANENI GAYATRI",
          "course_type": "TH"
        },
        {
          "source_row": 3,
          "slot": "G1+TG1",
          "venue": "PRP220",
          "faculty": "RAJKUMAR R",
          "course_type": "TH"
        },
        {
          "source_row": 4,
          "slot": "G2+TG2",
          "venue": "PRP214",
          "faculty": "SANTHI K",
          "course_type": "TH"
        },
        {
          "source_row": 5,
          "slot": "G1+TG1",
          "venue": "PRP214",
          "faculty": "SANTHI K",
          "course_type": "TH"
        }
      ]
    }
  ]
}
